{
  "$schema": "https://json-schema.org/draft/2020-12/schema",
  "$id": "urn:aibridge:contracts:v1:node",
  "title": "Node",
  "description": "@generated by scripts/generate-contracts.ts from src/orchestration/schemas.ts:107 (export nodeSchema). DO NOT EDIT. Invariants from .refine()/.superRefine() are NOT representable in JSON Schema and are absent from this file; they remain enforced by the TypeScript engine, which is the sole authority for them (ADR 0008 §2.2 Tier 2).",
  "type": "object",
  "properties": {
    "schemaVersion": {
      "anyOf": [
        {
          "type": "number",
          "const": 1,
          "title": "NodeSchemaVersion0"
        },
        {
          "type": "number",
          "const": 2,
          "title": "NodeSchemaVersion1"
        }
      ]
    },
    "nodeId": {
      "type": "string",
      "pattern": "^[A-Za-z0-9][A-Za-z0-9._:-]{0,127}$",
      "title": "NodeNodeId"
    },
    "meshId": {
      "type": "string",
      "pattern": "^[A-Za-z0-9][A-Za-z0-9._:-]{0,127}$",
      "title": "NodeMeshId"
    },
    "displayName": {
      "type": "string",
      "minLength": 1,
      "maxLength": 256,
      "title": "NodeDisplayName"
    },
    "enrollment": {
      "oneOf": [
        {
          "type": "object",
          "properties": {
            "status": {
              "type": "string",
              "const": "enrolled",
              "title": "NodeEnrollment0Status"
            },
            "enrolledAt": {
              "type": "string",
              "pattern": "^\\d{4}-\\d{2}-\\d{2}T\\d{2}:\\d{2}:\\d{2}(?:\\.\\d{1,9})?Z$",
              "title": "NodeEnrollment0EnrolledAt"
            }
          },
          "required": [
            "status",
            "enrolledAt"
          ],
          "additionalProperties": false,
          "title": "NodeEnrollment0"
        },
        {
          "type": "object",
          "properties": {
            "status": {
              "type": "string",
              "const": "revoked",
              "title": "NodeEnrollment1Status"
            },
            "enrolledAt": {
              "type": "string",
              "pattern": "^\\d{4}-\\d{2}-\\d{2}T\\d{2}:\\d{2}:\\d{2}(?:\\.\\d{1,9})?Z$",
              "title": "NodeEnrollment1EnrolledAt"
            },
            "revokedAt": {
              "type": "string",
              "pattern": "^\\d{4}-\\d{2}-\\d{2}T\\d{2}:\\d{2}:\\d{2}(?:\\.\\d{1,9})?Z$",
              "title": "NodeEnrollment1RevokedAt"
            }
          },
          "required": [
            "status",
            "enrolledAt",
            "revokedAt"
          ],
          "additionalProperties": false,
          "title": "NodeEnrollment1"
        }
      ]
    },
    "externalReferences": {
      "maxItems": 128,
      "type": "array",
      "items": {
        "type": "object",
        "properties": {
          "namespace": {
            "type": "string",
            "minLength": 1,
            "maxLength": 256,
            "title": "NodeExternalReferencesNamespace"
          },
          "id": {
            "type": "string",
            "minLength": 1,
            "maxLength": 4096,
            "title": "NodeExternalReferencesId"
          }
        },
        "required": [
          "namespace",
          "id"
        ],
        "additionalProperties": false
      },
      "title": "NodeExternalReferences"
    }
  },
  "required": [
    "schemaVersion",
    "nodeId",
    "meshId",
    "displayName",
    "enrollment",
    "externalReferences"
  ],
  "additionalProperties": false
}
